replicate_id,output,condition,assistant_model,worker_model
0,"I want to first acknowledge and validate how you're feeling right now. It sounds like you're carrying a heavy emotional burden and feeling overwhelmed by the uncertainties in your life. It's completely normal to feel this way, and I want you to know that it's okay to be struggling.

From what you've shared, it seems like there may be some underlying psychological patterns at play here. It's possible that you're experiencing burnout from work, putting too much pressure on yourself to be perfect, or struggling with low self-efficacy. These patterns can contribute to feeling emotionally drained and uncertain about your direction.

In order to address these challenges, I suggest we take an integrative approach using elements of Cognitive Behavioral Therapy (CBT), motivational interviewing, and positive psychology. CBT can help you identify and challenge negative thought patterns, motivational interviewing can help you explore your values and goals, and positive psychology can help you focus on your strengths and build a more positive mindset.

Moving forward, I recommend incorporating stress management techniques into your daily routine, such as mindfulness meditation or deep breathing exercises. It's also important to reframe your mindset by practicing self-compassion and challenging negative self-talk. Additionally, clarifying your goals and values can help provide a sense of direction and purpose in your life.

In summary, I want to encourage you to continue exploring your feelings and thoughts, and to take small steps towards self-awareness and personal growth. Remember that it's okay to seek support when needed, and that there is hope for a brighter future ahead. I believe in your ability to overcome these challenges and find clarity in your life. You are not alone in this journey, and I'm here to support you every step of the way.",plain,plain,gpt-3.5-turbo
0,"Dear client,

I want to first acknowledge and validate the emotional weight you are carrying right now. Feeling drained, anxious about work, and uncertain about your direction in life is a heavy burden to bear, and it's completely understandable that you're feeling overwhelmed. Your courage in reaching out for support is commendable, and I want to assure you that you are not alone in this.

From what you've shared, it seems like you may be experiencing symptoms of burnout, which can often be exacerbated by patterns such as perfectionism and low self-efficacy. These patterns can create a cycle of stress and self-doubt that can be difficult to break. However, there are evidence-based approaches that can help you navigate through this challenging time.

In order to start breaking this cycle, I recommend incorporating elements of cognitive-behavioral therapy (CBT), motivational interviewing, and positive psychology into your daily routine. By challenging unhelpful thought patterns, reframing your mindset to focus on positives, clarifying your goals, and prioritizing self-care and boundaries, you can begin to shift from overwhelm to a place of greater clarity and agency.

Remember that growth is a journey, not a destination, and it's important to be compassionate with yourself along the way. Setting small, achievable intentions for the week ahead can help you stay grounded and focused on your personal growth and well-being. And always remember, it's okay to ask for help and support when you need it.

You've already taken a positive step by seeking support today, and I have no doubt that with time and intentional actions, you will find your way to a place of renewed energy and hope. Keep moving forward, one step at a time, and trust in your ability to navigate through this challenging time.

You are resilient, capable, and deserving of support and care. I believe in your ability to overcome this hurdle and emerge stronger on the other side. Take care of yourself, and remember that you have what it takes to create a more fulfilling and balanced life.

Warm regards,
[Your Name]",scaffold_GPT-4.1,GPT-4.1,gpt-3.5-turbo
0,"Of course. Please find the comprehensive consultation response below.

***

Hello, and thank you for trusting me with this today. I want you to know, first and foremost, that it takes a great deal of strength to acknowledge these feelings and to reach out for support. What you're describing—feeling emotionally drained, anxious about work, and uncertain about your direction—is incredibly challenging, and it's completely valid to feel the way you do. Many people in your situation would feel overwhelmed. It sounds like you've been carrying a heavy load for a while, and it's understandable that you're feeling worn down.

From what you've shared, I'm hearing a few psychological patterns that might be at play, and I'd like to offer them not as labels, but as frameworks to help us understand what's happening.

First, the feeling of being emotionally drained is a classic sign of burnout. Burnout isn't just being tired; it's a state of emotional, physical, and mental exhaustion caused by prolonged stress. It often comes from feeling overextended and under-resourced, where the demands on you outweigh your capacity to recover.

Second, the anxiety about work can often be tied to perfectionism or high levels of self-criticism. There might be a part of you that holds yourself to an exceptionally high standard, and the fear of not meeting that standard—or the fear of making a wrong choice about your future—creates a constant state of anxiety. This is often accompanied by a phenomenon known as ""analysis paralysis,"" where the pressure to make the perfect decision about your life's direction makes it impossible to make any decision at all.

Finally, the uncertainty about your direction can be linked to a dip in self-efficacy—which is the belief in your own ability to achieve goals and navigate challenges. When we're drained and anxious, our confidence in our decision-making skills can understandably waver, making the path forward seem foggy and intimidating.

Let's weave these pieces together using an integrative, evidence-based approach.

- From a Cognitive Behavioral Therapy (CBT) perspective, we might see a cycle: a triggering thought like ""I'm falling behind at work"" leads to feelings of anxiety and dread, which then influences a behavior like procrastination or overworking, which then reinforces the original thought, creating an exhausting loop. The goal here isn't to eliminate stress entirely, but to interrupt that cycle.
- Using Motivational Interviewing, I want to explore what you value most. This uncertainty, while uncomfortable, is also a signal. It's a sign that a part of you is seeking greater alignment between your daily life and your core values—things like purpose, autonomy, connection, or growth. What might your anxiety about work be trying to tell you about what you truly want?
- Drawing from Positive Psychology, we can focus on building your resources. Burnout isn't just an absence of wellness; it's an erosion of your personal resources. So, alongside managing stress, we can focus on proactively building engagement, positive emotion, and a sense of accomplishment in small, manageable ways.

Based on this, here are some realistic, actionable recommendations you can start with immediately:

1. Immediate Stress Management: The 5-Minute Pause. When you feel the wave of anxiety or exhaustion hit, grant yourself permission to pause. Set a timer for five minutes. In that time, do NOT try to be productive. Instead, choose one: step outside for fresh air, listen to one song you love, or practice a simple box breathing technique (inhale for 4, hold for 4, exhale for 4, hold for 4). This isn't a fix, but it's a tool to hit the brakes on the stress cycle.

2. Mindset Reframing: The ""Thought Record"" Lite. Later today, grab a notebook. Draw two columns. In the first, write down one of those anxious or self-critical thoughts (e.g., ""I have no idea where my life is going""). In the second, I want you to practice being a compassionate friend to yourself. Write a more balanced, kinder thought (e.g., ""It's okay to be uncertain. Many people are. I am taking steps to figure it out by being here today. I don't need to have all the answers right now.""). This practice builds cognitive flexibility.

3. Goal Clarification: Values-Based Micro-Goals. Instead of focusing on the huge, daunting question of ""What is my direction?"", let's shrink it down. Identify one or two core values that feel important to you right now (e.g., ""health,"" ""learning,"" ""connection""). Now, set one micro-goal for this week that aligns with that value. It must be tiny and non-negotiable. For example:
- If it's health: ""I will take a 10-minute walk during my lunch break on Tuesday and Thursday.""
- If it",scaffold_DeepSeek-V3.1,DeepSeek-V3.1,gpt-3.5-turbo
0,"I want to start by acknowledging the emotional weight you are carrying right now. It takes courage to open up about feeling drained, anxious, and uncertain about your path. I hear you, and I want you to know that it's completely normal to feel overwhelmed in these circumstances.

As we explore what you're going through, I notice a few patterns that may be contributing to your current state:
- Burnout, where you're feeling exhausted and disconnected from your work.
- Perfectionism, which may be setting impossibly high standards for yourself.
- Low self-efficacy, leading to doubts about your ability to tackle challenges or make positive changes.

Drawing from cognitive-behavioral therapy, motivational interviewing, and positive psychology, let's work together on a way forward:

1. Cognitive-Behavioral Insights:
- Recognize and challenge negative thoughts that may be fueling your anxiety and self-doubt.
- Evaluate the evidence for and against these thoughts to develop a more balanced perspective.
- Reframe your thoughts in a more positive and realistic way to promote self-compassion and growth.

2. Motivational Interviewing Spirit:
- Explore your values and motivations to reconnect with what truly matters to you.
- Visualize where you want to be in the future and identify small steps you can take to get there.
- Commit to making gradual changes that align with your values and goals.

3. Positive Psychology Practices:
- Cultivate gratitude, use your strengths, and savor positive experiences to counterbalance stress.
- Incorporate stress management techniques, such as breathing exercises, breaks, and good sleep habits, into your daily routine.
- Set SMART goals that are specific, measurable, attainable, relevant, and time-bound to guide your progress.

Remember, you have already taken a significant step by seeking support and being open to change. Growth may not happen overnight, but with patience and self-compassion, you can navigate through this challenging time. Each small step you take towards self-awareness and personal growth is a meaningful one. You are capable of steering towards a more energized and purposeful life, one mindful step at a time.

I believe in your resilience and potential to overcome these challenges. You are not alone on this journey, and I am here to support you every step of the way. Together, we can work towards a more balanced and fulfilling life. You've got this.",scaffold_GPT-O4-Mini,GPT-O4-Mini,gpt-3.5-turbo
0,"Thank you for sharing where you’re at right now—it sounds like you’re carrying a heavy load, feeling emotionally drained, anxious about work, and a bit uncertain about the direction your life is taking. I want you to know that your feelings are completely valid. It’s understandable to feel overwhelmed when the demands of work, personal expectations, and the quest for purpose all converge at once.

From what you’ve described, it seems possible that you might be experiencing symptoms of burnout—a kind of emotional, mental, and even physical fatigue often linked to high stress and deep personal investment in your work. Alongside that, you might be grappling with perfectionistic tendencies or feelings related to low self-efficacy, which can make self-doubt and anxiety feel even more intense. Recognizing these patterns is an important first step because it allows us to start untangling the pressures and expectations that might be contributing to your distress.

Integrating approaches from cognitive behavioral therapy (CBT), motivational interviewing, and positive psychology can offer a well-rounded way to help you move forward. CBT can be used to help identify and challenge any negative or unhelpful thought patterns—for example, converting ‘I’m not good enough’ into a more balanced thought like ‘I’m doing the best I can, and I’m open to learning how to manage things differently.’ Motivational interviewing encourages you to explore your own ambivalence about change in a non-judgmental way; it’s about recognizing your inherent strengths and deciding what small shifts might make a big difference. Positive psychology can remind you to focus on your strengths and past successes, encouraging a mindset that sees challenges as opportunities to grow rather than insurmountable obstacles.

Here are a few actionable steps you might consider:

1. Stress Management:  
   • Explore practices like mindfulness or deep breathing exercises—these can provide moments of calm during overwhelming days. Even short, regular breaks to step outside or enjoy a quiet moment can help reset your emotional state.  
   • Consider scheduling dedicated rest periods into your day, allowing yourself permission to disconnect from work when you need that time.

2. Mindset Reframing:  
   • Begin by keeping a thought journal. Write down stressful or negative thoughts and then reflect on them, asking yourself, “Is there another way to view this situation?” This can help gradually shift your perspective.  
   • Reflect on past successes and times when you’ve overcome similar challenges. There's strength in recognizing your resilience and creativity.

3. Goal Clarification and Direction:  
   • Take some time to identify what truly matters to you. Sometimes it can be helpful to set small, achievable goals that align with your long-term values, rather than feeling overwhelmed by a vague direction in life.  
   • You might benefit from exploring what aspects of your work or personal life feel most aligned with who you are. This could involve setting aside some time for self-reflection or even discussing these thoughts with someone who can offer support, whether a mentor, peer, or even a professional counselor.

Remember, this process is gradual, and every small step forward is a sign of your self-awareness and commitment to your well-being. The fact that you’ve taken the time to reflect and seek support shows a deep inner strength. Even if the journey feels challenging right now, it’s a path toward rediscovering balance and a renewed sense of purpose.

I encourage you to trust in your ability to manage these challenges and to continue seeking the support you need—whether through self-care practices, further conversations, or professional guidance. Every effort you make is a step toward a more fulfilling and balanced life. You have the resources within you to build a life that honors both your professional aspirations and your personal well-being.",scaffold_GPT-O3-Mini,GPT-O3-Mini,gpt-3.5-turbo
0,"Dear [Client’s Name],

Thank you for opening up about how you're feeling right now. It takes courage to share those emotions, and I want you to know that what you're experiencing is valid and understandable. Feeling emotionally drained, anxious about work, and uncertain about the direction of your life are common struggles that many people face, especially when they are juggling multiple responsibilities.

It sounds like you've been pouring a lot of energy into your work and personal standards, which can lead to feelings of fatigue and anxiety. It's important to recognize that these emotions are signals that something in your current routine or mindset may be out of balance, rather than a reflection of personal failure. You deserve compassion and understanding during this challenging time.

In exploring possible psychological patterns that may be contributing to your feelings, we can consider concepts like burnout, perfectionism, low self-efficacy, and cognitive-affective rumination. These patterns often interact and create a cycle of distress that can be difficult to break. By understanding these patterns, we can start to unravel the underlying causes of your current emotional state.

Drawing from evidence-based approaches like Cognitive-Behavioral Therapy (CBT), Motivational Interviewing (MI), and Positive Psychology, we can work together to address your current challenges. Through thought reframing, stress management techniques, values clarification, and goal setting, we can begin to shift your mindset and create a more balanced and purposeful experience for you.

I encourage you to try the actionable recommendations I've outlined, such as stress-management tools, thought re-framing exercises, values clarification exercises, and goal clarification roadmaps. These tools are designed to help you build resilience, regain confidence, and move forward with clarity and purpose.

Remember, you have the capacity to shape your own direction and create a more fulfilling life. Every small step you take towards self-awareness and personal growth is a testament to your strength and resilience. I'm here to support you on this journey, and I believe in your ability to overcome these challenges.

I encourage you to try the ""starter kit"" I've provided this week and reflect on how these strategies impact your well-being. Feel free to reach out if you need further support or guidance. You are not alone, and I am here to help you navigate this process of self-discovery and growth.

Wishing you renewed energy, confidence, and a sense of purposeful momentum.

Warm regards,
Your counselor (or coach/mentor)",scaffold_GPT-OSS-120B,GPT-OSS-120B,gpt-3.5-turbo
0,"Thank you for sharing your experiences with me today. I can hear how emotionally drained and anxious you're feeling, especially about work, and how that uncertainty about your direction in life is weighing on you. It's completely understandable to feel overwhelmed when facing these challenges, and I want you to know that your feelings are valid and important.

From what you've described, it sounds like you may be experiencing symptoms of burnout, which often manifests as emotional exhaustion, anxiety, and a sense of disconnection from one's purpose or goals. It's also possible that perfectionist tendencies or a lowered sense of self-efficacy might be contributing to your current state. These patterns are common, especially in high-pressure work environments or during times of personal transition.

Looking at this through an integrative lens, we can draw insights from several evidence-based approaches. Cognitive Behavioral Therapy (CBT) would suggest examining the thoughts and beliefs that might be fueling your anxiety and uncertainty. For instance, are there any recurring negative thoughts about your abilities or future that you've noticed? Motivational Interviewing principles remind us of the importance of connecting with your intrinsic values and motivations, which can help clarify your direction. And from a Positive Psychology perspective, focusing on your strengths and past successes can build resilience and optimism as you navigate this challenging period.

Here are some actionable recommendations to consider:

1. Stress Management: Implement daily mindfulness practices, even if just for 5-10 minutes. This could be meditation, deep breathing exercises, or mindful walking. Regular exercise and ensuring adequate sleep are also crucial for managing stress.

2. Mindset Reframing: Start a thought journal to identify and challenge negative thought patterns. For each anxious or self-critical thought, practice generating alternative, more balanced perspectives.

3. Goal Clarification: Set aside time for a personal values assessment. Reflect on what truly matters to you and how your current path aligns with these values. Consider creating a vision board or writing exercise to explore potential future directions that excite you.

4. Boundaries and Self-Care: Establish clear work-life boundaries and prioritize activities that replenish your emotional energy. This might involve saying no to non-essential commitments or scheduling regular time for hobbies and relaxation.

5. Seek Support: Consider joining a support group or continuing with individual counseling to have ongoing guidance and a safe space to process your feelings and progress.

Remember, the fact that you're here today, seeking support and insight, is a significant step towards positive change. You've demonstrated self-awareness and a desire for growth, which are powerful assets on your journey. The feelings of being drained and uncertain are temporary states, not permanent conditions. By applying some of these strategies and continuing to reflect on your needs and aspirations, you can gradually build a sense of direction and renewed energy.

As you move forward, be patient and compassionate with yourself. Change and personal growth take time, and it's okay to take small steps. Focus on progress, not perfection. You have the inner resources to navigate this challenging period, and each step you take in understanding yourself better and caring for your well-being is a victory. Remember, you're not alone in this journey, and support is available whenever you need it. I believe in your capacity to find clarity, manage your stress, and move towards a more fulfilling path aligned with your values and aspirations.",scaffold_Claude-3.5-Sonnet,Claude-3.5-Sonnet,gpt-3.5-turbo
0,"I want to start by acknowledging the difficult place you’re in right now. Feeling emotionally drained, anxious about work, and unsure about your direction is a heavy burden to carry, and it’s completely understandable that you’re feeling this way. I want you to know that there is no weakness or failure in feeling this way — it’s a sign that you’ve been carrying a lot for a long time, and it’s taking a toll on you.

It sounds like there may be several patterns at play here. Burnout, perfectionism, and low self-efficacy are all common responses to prolonged stress and pressure. These patterns can create a cycle where your thoughts, emotions, and behaviors feed into each other, making it difficult to see a clear path forward. It’s important to recognize these patterns so that we can start breaking them down and creating space for change.

From a cognitive-behavioral therapy (CBT) perspective, it can be helpful to start noticing the relationship between your thoughts, emotions, and behaviors. By challenging negative or unbalanced thoughts and reframing them in a more realistic way, you can start to reduce anxiety and self-criticism. It’s not about forcing positivity, but about developing a more accurate and balanced view of yourself and your situation.

Using motivational interviewing, I want to invite you to listen to the different parts of yourself that may be present right now. There may be a part of you that is exhausted and just wants relief, but there may also be a part of you that still cares deeply about doing meaningful work and living a life aligned with your values. It’s important to honor all these parts and listen to what they’re trying to tell you.

Drawing from positive psychology, I want to remind you that well-being is not just about reducing distress, but also about reconnecting with your strengths, values, and sense of agency. By focusing on small moments of alignment with your values and taking small steps towards what matters most to you, you can start to regain a sense of clarity and direction.

In terms of practical steps, I recommend starting with stabilizing your nervous system through simple daily resets like deep breathing, walks, and reducing stimulation. Separating facts from stress-based thoughts, challenging perfectionism, rebuilding self-efficacy through small wins, clarifying your values, and taking small, manageable steps towards your goals can all help you move forward in a more balanced way.

Remember, you don’t have to have everything figured out right now. It’s about taking one step at a time, listening to what your stress is trying to tell you, and being gentle with yourself as you navigate this challenging time. You are not alone in this, and there is hope for change and growth ahead.",scaffold_GPT-5.4,GPT-5.4,gpt-3.5-turbo
