replicate_id,output,condition,assistant_model,worker_model
0,"I want to start by acknowledging the weight you're carrying right now. Feeling emotionally drained, anxious about work, and uncertain about your direction is incredibly tough. But I want you to know that it's okay to feel this way. You're not alone, and you're not broken. You're going through a challenging time, and it's important to honor that.

From what you've shared, it seems like there are some underlying patterns at play here. Burnout, perfectionism, low self-efficacy, and a values disconnect are all common experiences that can contribute to the feelings you're experiencing. These patterns are not uncommon, and they can be addressed with the right support and tools.

I want to offer you an integrative framework that combines elements of Cognitive-Behavioral Therapy (CBT), Motivational Interviewing (MI), and Positive Psychology. By looking at your situation through these different lenses, we can gain a deeper understanding of what's going on and how to move forward.

First, I encourage you to start with some practical steps to address your current state. Establishing a recovery ritual, shrinking your time horizon, conducting a values audit, challenging ""shoulds,"" and considering professional support are all actionable recommendations that can help you navigate this challenging time.

Remember, you are not behind, and your uncertainty is not a sign of failure. It's a sign of growth and evolution. Take one step at a time, be patient with yourself, and be willing to explore what comes up for you.

You have the strength and resilience to navigate this. You are deserving of rest, clarity, and support. Remember, one step, one day, one kind thought toward yourself is enough for now. You are enough.",scaffold_Claude-Opus-4.6,Claude-Opus-4.6,gpt-3.5-turbo
0,"I can see how challenging this period of your life is, and I want to commend you for reaching out and seeking support. It takes a lot of courage to acknowledge when things feel overwhelming and to take steps towards healing and growth.

First and foremost, I want to acknowledge the emotional weight you are carrying right now. Feeling drained, anxious, and uncertain about the future are all valid experiences, and it's important to give yourself permission to feel these emotions without judgment. It's clear that you have been pushing yourself hard, and it's no wonder that you are feeling exhausted and overwhelmed.

As we explore your current struggles, it seems like there are some common psychological patterns at play. Burnout, perfectionism, and low self-efficacy are all contributing to your current state. These patterns can create a cycle of stress, anxiety, and self-doubt that can be difficult to break free from.

In approaching your situation, I want to draw upon the principles of Cognitive Behavioral Therapy (CBT), Motivational Interviewing, and Positive Psychology to help you navigate this challenging time.

CBT can help us examine the thoughts, feelings, and behaviors that are contributing to your emotional state. By identifying and challenging negative thought patterns, we can begin to shift your perspective and reduce anxiety.

Motivational Interviewing can help us explore your ambivalence about the future and work towards clarifying your goals and values. It's okay to feel uncertain right now, and by approaching this uncertainty with curiosity and openness, we can start to uncover what truly matters to you.

Positive Psychology reminds us that even in difficult times, there are strengths and values that can guide us towards a more fulfilling life. By focusing on what brings you joy, meaning, and vitality, we can start to rebuild a sense of purpose and direction.

In terms of practical strategies, I recommend starting with stress management techniques to help regulate your nervous system and create a sense of calm. Implementing a transition ritual at the end of your workday can help create a boundary between work and personal life, allowing you to unwind and recharge. Additionally, somatic grounding techniques like the 5-4-3-2-1 method can help bring you back to the present moment and reduce anxiety.

Moving forward, it may also be helpful to explore mindfulness practices, journaling, or seeking support from a therapist or counselor to further process your emotions and navigate your path forward.

Overall, I want to leave you with a sense of hope and encouragement. You have already taken the first step towards healing by seeking support, and I believe that with time, self-reflection, and self-compassion, you can begin to find clarity and purpose in your life once again. Remember that you are not alone in this journey, and there is always support available to help you along the way.",scaffold_Gemini-3.1-Pro,Gemini-3.1-Pro,gpt-3.5-turbo
